{
  "checks": {
    "coefficient_partition_recomputed": true,
    "eligible_domain_source_locked": true,
    "empty_domain_vacuity_explicit": true,
    "existential_witness_not_fabricated": true,
    "h1_h9_roles_disjoint": true,
    "h1_root_remains_not_testable": true,
    "h9_decay_axis_none_preserved": true,
    "no_formal_or_synthetic_carrier_admitted": true
  },
  "claim_boundary": {
    "active_carrier_mathematical_nonexistence_proved": false,
    "actual_active_support_proved": false,
    "empty_domain_audit_passed": true,
    "fixed_h0_2_arithmetic_progress": false,
    "fixed_h0_2_preserved_as_requirement": true,
    "h9_literal_weight_registry_closed": false,
    "named_fixed_phase_theorem": false,
    "prime_pair_lower_bound": false,
    "production_local_occurrence_family_proved_nonempty": false,
    "program_positive_L2": false,
    "strict_one_over_400": false,
    "twin_prime_theorem": false
  },
  "coefficient_audit": {
    "classified_total": 0,
    "missing_coefficient_record_count": 0,
    "nonzero_literal_coefficient_count": 0,
    "partition_identity_verified": true,
    "required_record_fields": [
      "eligible_carrier_id",
      "literal_target_expression_locator",
      "literal_physical_coefficient",
      "physical_normalization",
      "nonzero_proof_locator"
    ],
    "tested_eligible_carrier_count": 0,
    "universal_all_eligible_carriers_active": true,
    "universal_statement_is_vacuous": true,
    "zero_literal_coefficient_count": 0
  },
  "eligible_domain": {
    "eligibility_rule": "SOURCE_BACKED_PROVED_LOCAL_EDGE_CARRIER_ONLY",
    "eligible_carrier_count": 0,
    "eligible_carrier_ids": [],
    "formal_archive_rows_admitted": false,
    "scope": "FROZEN_CONTIGUOUS_OCCURRENCE_SOURCE_CORRIDOR_TPC133_172",
    "source": "TPC176.coverage_gluing_audit",
    "synthetic_carriers_admitted": false
  },
  "h1_active_support_root": {
    "closed": false,
    "node_id": "H1.actual_active_support_certificate",
    "reason": "NO_SOURCE_BACKED_ELIGIBLE_CARRIER; EMPTY_DOMAIN_UNIVERSAL_HAS_NO_EXISTENTIAL_CONTENT",
    "status": "NOT_TESTABLE",
    "support_semantics": "ACTUAL_ACTIVE_SUPPORT"
  },
  "h9_literal_weight_separation": {
    "consumed_by_tpc177": false,
    "decay_axis": "NONE",
    "imported_as_h1_support_evidence": false,
    "logically_identical_to_h1_active_support_root": false,
    "node_id": "H9.literal_weight_registry",
    "registry_closed_by_tpc177": false,
    "registry_identification_creates_decay": false,
    "registry_role": "PHYSICAL_REGISTRY",
    "source_status": "NOT_TESTABLE"
  },
  "mutation_regressions": {
    "fabricated_eligible_carrier_rejected": true,
    "fabricated_nonzero_coefficient_rejected": true,
    "h1_root_proved_promotion_rejected": true,
    "h9_decay_creation_rejected": true,
    "implicit_h9_import_rejected": true,
    "program_L2_promotion_rejected": true,
    "source_hash_drift_rejected": true,
    "vacuity_to_existence_rejected": true
  },
  "schema": "tpc-177-actual-active-support-vacuity-audit-v1",
  "source_locks": [
    {
      "canonical_utf8_lf_sha256": "f800ed30020d7626df1e091aed36852be8064cef7d4854c658e565d3e534e9f5",
      "hash_mode": "CANONICAL_UTF8_LF_V2",
      "hash_semantics": "INTEGRITY_ONLY",
      "path": "papers/tpc-166-refined-h1-crosswalk-frontier-decision/experiments/tpc166_refined_h1_frontier.json",
      "source_id": "TPC166.refined_h1_frontier"
    },
    {
      "canonical_utf8_lf_sha256": "ab00019765f3ee26c442eaf677b99e8796013fc424b4e14c4edc6d1fd7b7bec7",
      "hash_mode": "CANONICAL_UTF8_LF_V2",
      "hash_semantics": "INTEGRITY_ONLY",
      "path": "papers/tpc-171-source-locked-occurrence-phase-return-integration/experiments/tpc171_integration_manifest.json",
      "source_id": "TPC171.integration_manifest"
    },
    {
      "canonical_utf8_lf_sha256": "60f11c39f3db95ee857c6ed3cb0812172011957dbf5716cf4eb78ed04016d4c9",
      "hash_mode": "CANONICAL_UTF8_LF_V2",
      "hash_semantics": "INTEGRITY_ONLY",
      "path": "papers/tpc-175-declared-corpus-local-edge-family/experiments/tpc175_local_edge_family.json",
      "source_id": "TPC175.local_edge_family"
    },
    {
      "canonical_utf8_lf_sha256": "c8f3cb6a30600ee496ed2117ad94743aa5afc66bd3fca0d9977031dac6cd0cc6",
      "hash_mode": "CANONICAL_UTF8_LF_V2",
      "hash_semantics": "INTEGRITY_ONLY",
      "path": "papers/tpc-176-source-backed-coverage-gluing-audit/experiments/tpc176_coverage_gluing_audit.json",
      "source_id": "TPC176.coverage_gluing_audit"
    }
  ],
  "status": "PASS",
  "vacuity_firewall": {
    "empty_domain_promoted_to_existence": false,
    "existential_active_support_proved": false,
    "existential_active_support_witness_count": 0,
    "mathematical_nonexistence_proved": false,
    "status": "VACUOUS_EMPTY_ELIGIBLE_DOMAIN",
    "universal_statement_true": true
  }
}
